{
  "schemaVersion": "1.0.0",
  "profileId": "CKES-BENCHMARK-RUN-PROFILE-REF-WARM-001",
  "description": "Supplementary warm profile template (G1). Non-blocking for Reference Baseline 001 designation.",
  "recordedDate": "2026-09-19",
  "dryRun": false,
  "retrievalMode": "deterministic_fixture",
  "isolationMode": "truncate_between_scenarios",
  "deterministicAi": true,
  "anchors": {
    "gitCommit": "REPLACE_AT_EXECUTION",
    "policyFile": "packages/policy/cals-policy.v1.json",
    "policyVersion": "1.0.0",
    "openaiMode": "deterministic_off",
    "harnessPackageVersion": "0.1.0",
    "scorerVersion": "1.0.0-g1"
  },
  "databaseProfile": "warm",
  "warmStateRef": "UNVERIFIED_G1_TEMPLATE",
  "trialPolicy": {
    "defaultTrials": 1,
    "byExecutionClass": [
      { "executionMode": "decision_slice", "llmPolicy": "required", "trials": 3 }
    ],
    "modelCallLimit": 2000,
    "budgetUsdCeiling": 15,
    "onCeilingExhausted": "fail_run",
    "incompleteTrialsInvalidate": "run",
    "aggregation": "worst_case_safety"
  },
  "relatedDocs": [
    "docs/Development/Handover_03_Implementation_Plan.md"
  ]
}
